id,name,category,rating,comment,userId,createdAt
P00260,Board Game,Games,1,Very boring and overly complicated—nobody enjoyed it.,92kiZtoVxD,2024-12-26 19:16:44
P00260,Board Game,Games,2,"Too many rules, and it takes forever to finish a game.",umjFRRB893,2024-12-26 23:20:23
P00260,Board Game,Games,3,"Fun for a while, but it gets repetitive quickly.",LuVCrkJOKQ,2024-12-25 8:49:04
P00260,Board Game,Games,4,"Engaging and challenging, great for family game nights.",9mCX4BVkbI,2024-12-24 23:26:59
P00260,Board Game,Games,5,Amazing game! Keeps everyone entertained for hours.,08BgCj8kI6,2024-12-24 18:10:16
P00123,Wireless Earbuds,Electronics,1,"Terrible product! Constant connection issues, poor sound quality, and they stopped working after just a week.",A8Q0r3LSro,2024-12-25 7:33:11
P00123,Wireless Earbuds,Electronics,2,"Uncomfortable and unreliable. The sound cuts out constantly, and the battery drains incredibly fast.",Ee8CNIIKRy,2024-12-26 4:42:29
P00123,Wireless Earbuds,Electronics,3,Mediocre at best. Connectivity is spotty and the sound quality is disappointing.,YUZw9sy20C,2024-12-24 8:19:45
P00456,Organic Coffee Beans,Grocery,4,"Really smooth flavor, nice aroma, and consistent quality.",pELF8ty8v1,2024-12-24 13:01:35
P00456,Organic Coffee Beans,Grocery,5,"Absolutely fantastic coffee! Rich, full-bodied, and perfect every single time.",hcDeBIfRXd,2024-12-25 22:31:22
P00456,Organic Coffee Beans,Grocery,5,Best organic coffee I've ever tried. Worth every penny!,pwkNn8ueCC,2024-12-24 22:14:46
P00789,Cotton T-Shirt,Clothing,1,"Horrible quality! Ripped after first wash, fabric is thin and cheap.",yYsibpNaBU,2024-12-25 3:53:40
P00789,Cotton T-Shirt,Clothing,2,"Terrible fit, fades quickly, and feels uncomfortable.",r0pgj8uLSa,2024-12-26 14:30:56
P00789,Cotton T-Shirt,Clothing,3,"Poor quality fabric, shrinks easily, not worth the price.",AYVwLV6wwQ,2024-12-24 22:45:56
P00102,Portable Charger,Electronics,4,"Reliable charger, good battery capacity, charges quickly.",JeVH0oRA67,2024-12-24 2:55:08
P00102,Portable Charger,Electronics,5,"Absolutely amazing! Compact, powerful, and works with multiple devices.",2Fl7OulY4b,2024-12-25 16:00:53
P00102,Portable Charger,Electronics,5,Best portable charger I've ever owned. Highly recommend!,x3qoLk51hE,2024-12-24 22:45:56
P00135,Running Shoes,Shoes,4,"Comfortable and lightweight, good for everyday running.",9mL6S4aYk4,2024-12-26 6:23:24
P00135,Running Shoes,Shoes,5,"Excellent running shoes! Perfect fit, great support.",3CWyqdtT82,2024-12-25 22:08:32
P00135,Running Shoes,Shoes,5,Absolutely fantastic! Feels like running on clouds.,knutxysegV,2024-12-24 3:25:58
P00168,Bamboo Cutting Board,Kitchen,1,"Terrible cutting board! Warps immediately, looks cheap.",vdCRsWQLDT,2024-12-26 3:41:34
P00168,Bamboo Cutting Board,Kitchen,2,"Poor quality, uneven surface, not durable at all.",H0Ivlfm8Kq,2024-12-26 12:32:56
P00168,Bamboo Cutting Board,Kitchen,3,Mediocre at best. Doesn't meet expectations.,fAfCIxGOq8,2024-12-26 10:39:33
P00191,Digital Camera,Electronics,4,"Good image quality, easy to use, nice features.",yldPNzTteW,2024-12-25 3:34:16
P00191,Digital Camera,Electronics,5,"Outstanding camera! Crystal clear images, great zoom.",SMQnCUji7T,2024-12-26 0:11:36
P00191,Digital Camera,Electronics,5,Absolutely love this camera! Professional-level performance.,0SXLnvyj9l,2024-12-26 20:12:25
P00214,Organic Shampoo,Beauty,1,Awful shampoo! Dried out my hair completely.,BKXEl9tonE,2024-12-25 8:13:04
P00214,Organic Shampoo,Beauty,2,"Terrible for my hair type, leaves residue.",l7bsselgtY,2024-12-26 0:03:12
P00214,Organic Shampoo,Beauty,3,"Underwhelming product, not worth the price.",gaGt0Wi3x2,2024-12-24 13:43:52
P00789,Wireless Mouse,Electronics,4,"Smooth and responsive, good connectivity.",ODEzgPAedB,2024-12-24 19:31:17
P00789,Wireless Mouse,Electronics,5,"Excellent mouse! Precise tracking, comfortable design.",VwekCnQkUu,2024-12-26 0:59:52
P00789,Wireless Mouse,Electronics,5,Best wireless mouse I've used. Highly recommended!,yLgXituJnT,2024-12-24 3:29:04
P01617,Board Game,Games,2,"Too complicated, takes forever to understand the rules.",fcmXwFHOvx,2024-12-26 23:20:23
P01640,Board Game,Games,3,"Mediocre game, gets repetitive quickly.",3u5SgjWuJE,2024-12-25 8:49:04